"No.","Time","Source","Destination","Protocol","Length","Info"
"8871","4.641602","192.168.1.209","8.8.8.8","TCP","74","49557  >  53 [SYN] Seq=0 Win=42340 Len=0 MSS=1460 SACK_PERM=1 TSval=302519442 TSecr=0 WS=128"
"8901","4.668587","192.168.1.209","8.8.8.8","TCP","66","49557  >  53 [ACK] Seq=1 Ack=1 Win=42368 Len=0 TSval=302519445 TSecr=2661651280"
"8902","4.668856","192.168.1.209","8.8.8.8","TCP","66","49557  >  53 [FIN, ACK] Seq=1 Ack=1 Win=42368 Len=0 TSval=302519445 TSecr=2661651280"
"8935","4.703464","192.168.1.209","8.8.8.8","TCP","66","49557  >  53 [ACK] Seq=2 Ack=2 Win=42368 Len=0 TSval=302519448 TSecr=2661651315"
"11518","5.822983","192.168.1.99","54.175.224.52","TCP","66","38556  >  2350 [ACK] Seq=1 Ack=1 Win=390 Len=0 TSval=485409936 TSecr=1431184303"
"19953","9.482432","192.168.1.58","52.42.108.30","TCP","66","38267  >  443 [ACK] Seq=1 Ack=32 Win=415 Len=0 TSval=175189417 TSecr=794105723"
"20223","9.574208","192.168.1.58","52.32.33.253","TCP","1514","57010  >  80 [ACK] Seq=1 Ack=1 Win=502 Len=1448 TSval=175189427 TSecr=1611698530 [TCP segment of a reassembled PDU]"
"21682","9.984046","192.168.1.58","52.32.33.253","TCP","1514","[TCP Retransmission] 57010  >  80 [ACK] Seq=4294962953 Ack=1 Win=502 Len=1448 TSval=175189468 TSecr=1611713083"
"22016","10.087881","192.168.1.58","52.32.33.253","TCP","1514","[TCP Retransmission] 57010  >  80 [ACK] Seq=4294964401 Ack=1 Win=502 Len=1448 TSval=175189478 TSecr=1611713186"
"22017","10.088158","192.168.1.58","52.32.33.253","TCP","1514","[TCP Retransmission] 57010  >  80 [ACK] Seq=4294965849 Ack=1 Win=502 Len=1448 TSval=175189478 TSecr=1611713186"
"22507","10.190990","192.168.1.58","52.32.33.253","TCP","1514","57010  >  80 [ACK] Seq=1449 Ack=1 Win=502 Len=1448 TSval=175189488 TSecr=1611713211 [TCP segment of a reassembled PDU]"
"22509","10.191163","192.168.1.58","52.32.33.253","TCP","1514","[TCP Previous segment not captured] 57010  >  80 [ACK] Seq=4345 Ack=1 Win=502 Len=1448 TSval=175189488 TSecr=1611713211 [TCP segment of a reassembled PDU]"
"22510","10.191155","192.168.1.58","52.32.33.253","TCP","1514","[TCP Retransmission] 57010  >  80 [ACK] Seq=2897 Ack=1 Win=502 Len=1448 TSval=175189488 TSecr=1611713211"
"22960","10.295492","192.168.1.58","52.32.33.253","TCP","1514","57010  >  80 [ACK] Seq=5793 Ack=1 Win=502 Len=1448 TSval=175189499 TSecr=1611713238 [TCP segment of a reassembled PDU]"
"22962","10.295617","192.168.1.58","52.32.33.253","TCP","1019","57010  >  80 [PSH, ACK] Seq=7241 Ack=1 Win=502 Len=953 TSval=175189499 TSecr=1611713238 [TCP segment of a reassembled PDU]"
"23546","10.441682","192.168.1.58","52.32.33.253","TCP","66","57010  >  80 [ACK] Seq=8194 Ack=1449 Win=502 Len=0 TSval=175189513 TSecr=1611713272"
"23550","10.446046","192.168.1.58","52.32.33.253","TCP","66","57010  >  80 [ACK] Seq=8194 Ack=7241 Win=484 Len=0 TSval=175189513 TSecr=1611713272"
"23551","10.446273","192.168.1.58","52.32.33.253","TCP","66","57010  >  80 [ACK] Seq=8194 Ack=9464 Win=501 Len=0 TSval=175189513 TSecr=1611713272"
"29488","14.473999","192.168.1.58","52.42.108.30","TCP","66","38267  >  443 [ACK] Seq=1 Ack=33 Win=415 Len=0 TSval=175189917 TSecr=794106974"
"31483","16.904866","192.168.1.58","34.207.189.81","TCP","66","34914  >  2350 [ACK] Seq=1 Ack=1 Win=373 Len=0 TSval=175190160 TSecr=1431188199"
"88918","48.458547","192.168.1.209","52.87.251.209","TCP","66","53738  >  2350 [ACK] Seq=1 Ack=1 Win=390 Len=0 TSval=302523824 TSecr=1431196179"
"125424","69.411188","192.168.1.58","52.42.108.30","TLSv1.2","97","Encrypted Alert"
"125427","69.411667","192.168.1.58","52.42.108.30","TCP","66","38267  >  443 [RST, ACK] Seq=32 Ack=33 Win=415 Len=0 TSval=175195406 TSecr=794106974"
"125428","69.411797","192.168.1.58","52.32.33.253","TCP","1514","57010  >  80 [ACK] Seq=8194 Ack=9464 Win=502 Len=1448 TSval=175195406 TSecr=1611713272"
"125429","69.411941","192.168.1.58","52.32.33.253","TCP","1514","57010  >  80 [ACK] Seq=9642 Ack=9464 Win=502 Len=1448 TSval=175195406 TSecr=1611713272"
"125430","69.412072","192.168.1.58","52.32.33.253","TCP","1514","57010  >  80 [ACK] Seq=11090 Ack=9464 Win=502 Len=1448 TSval=175195406 TSecr=1611713272 [TCP segment of a reassembled PDU]"
"125782","69.590288","192.168.1.58","52.32.33.253","TCP","1514","57010  >  80 [ACK] Seq=12538 Ack=9464 Win=502 Len=1448 TSval=175195423 TSecr=1611728043 [TCP segment of a reassembled PDU]"
"125783","69.590952","192.168.1.58","52.32.33.253","TCP","1514","57010  >  80 [ACK] Seq=13986 Ack=9464 Win=502 Len=1448 TSval=175195423 TSecr=1611728043 [TCP segment of a reassembled PDU]"
"125784","69.591233","192.168.1.58","52.32.33.253","TCP","1514","57010  >  80 [ACK] Seq=15434 Ack=9464 Win=502 Len=1448 TSval=175195423 TSecr=1611728043 [TCP segment of a reassembled PDU]"
"125819","69.596292","192.168.1.58","52.32.33.253","TCP","1514","57010  >  80 [ACK] Seq=16882 Ack=9464 Win=502 Len=1448 TSval=175195427 TSecr=1611728053 [TCP segment of a reassembled PDU]"
"126103","69.726116","192.168.1.58","52.32.33.253","TCP","1514","57010  >  80 [ACK] Seq=18330 Ack=9464 Win=502 Len=1448 TSval=175195441 TSecr=1611728088 [TCP segment of a reassembled PDU]"
"126105","69.726250","192.168.1.58","52.32.33.253","TCP","1019","57010  >  80 [PSH, ACK] Seq=19778 Ack=9464 Win=502 Len=953 TSval=175195441 TSecr=1611728088 [TCP segment of a reassembled PDU]"
"126384","69.884547","192.168.1.58","52.32.33.253","TCP","66","57010  >  80 [ACK] Seq=20731 Ack=18152 Win=491 Len=0 TSval=175195454 TSecr=1611728125"
"126385","69.884543","192.168.1.58","52.32.33.253","TCP","66","57010  >  80 [ACK] Seq=20731 Ack=13808 Win=491 Len=0 TSval=175195454 TSecr=1611728125"
"126386","69.884677","192.168.1.58","52.32.33.253","TCP","66","57010  >  80 [ACK] Seq=20731 Ack=18927 Win=502 Len=0 TSval=175195454 TSecr=1611728125"
"169826","95.902745","192.168.1.99","54.175.224.52","TCP","66","[TCP Dup ACK 11518#1] 38556  >  2350 [ACK] Seq=1 Ack=1 Win=390 Len=0 TSval=485418944 TSecr=1431206823"
"189862","106.992056","192.168.1.58","34.207.189.81","TCP","66","[TCP Dup ACK 31483#1] 34914  >  2350 [ACK] Seq=1 Ack=1 Win=373 Len=0 TSval=175199168 TSecr=1431210715"
"229781","129.377682","192.168.1.58","52.32.33.253","TCP","1514","57010  >  80 [ACK] Seq=20731 Ack=18927 Win=502 Len=1448 TSval=175201407 TSecr=1611728125"
"229782","129.377689","192.168.1.58","52.32.33.253","TCP","1514","57010  >  80 [ACK] Seq=22179 Ack=18927 Win=502 Len=1448 TSval=175201407 TSecr=1611728125"
"229783","129.377842","192.168.1.58","52.32.33.253","TCP","1514","57010  >  80 [ACK] Seq=23627 Ack=18927 Win=502 Len=1448 TSval=175201407 TSecr=1611728125 [TCP segment of a reassembled PDU]"
"229785","129.377975","192.168.1.58","52.32.33.253","TCP","1514","[TCP Previous segment not captured] 57010  >  80 [ACK] Seq=26523 Ack=18927 Win=502 Len=1448 TSval=175201407 TSecr=1611728125 [TCP segment of a reassembled PDU]"
"229786","129.377972","192.168.1.58","52.32.33.253","TCP","1514","[TCP Retransmission] 57010  >  80 [ACK] Seq=25075 Ack=18927 Win=502 Len=1448 TSval=175201407 TSecr=1611728125"
"229787","129.378119","192.168.1.58","52.32.33.253","TCP","1514","57010  >  80 [ACK] Seq=27971 Ack=18927 Win=502 Len=1448 TSval=175201407 TSecr=1611728125 [TCP segment of a reassembled PDU]"
"230094","129.506337","192.168.1.58","52.32.33.253","TCP","1514","[TCP Previous segment not captured] 57010  >  80 [ACK] Seq=30867 Ack=18927 Win=502 Len=1448 TSval=175201419 TSecr=1611743035 [TCP segment of a reassembled PDU]"
"230095","129.506335","192.168.1.58","52.32.33.253","TCP","1514","[TCP Retransmission] 57010  >  80 [ACK] Seq=29419 Ack=18927 Win=502 Len=1448 TSval=175201419 TSecr=1611743035"
"230099","129.506621","192.168.1.58","52.32.33.253","TCP","1018","57010  >  80 [PSH, ACK] Seq=32315 Ack=18927 Win=502 Len=952 TSval=175201419 TSecr=1611743035 [TCP segment of a reassembled PDU]"
"230782","129.752546","192.168.1.58","52.32.33.253","TCP","66","57010  >  80 [ACK] Seq=33267 Ack=23271 Win=491 Len=0 TSval=175201444 TSecr=1611743101"
"230787","129.753468","192.168.1.58","52.32.33.253","TCP","66","57010  >  80 [ACK] Seq=33267 Ack=28390 Win=486 Len=0 TSval=175201444 TSecr=1611743101"
"244375","138.539212","192.168.1.209","52.87.251.209","TCP","66","[TCP Dup ACK 88918#1] 53738  >  2350 [ACK] Seq=1 Ack=1 Win=390 Len=0 TSval=302532832 TSecr=1431218700"
"302090","175.216640","192.168.1.58","54.164.178.66","TLSv1.2","97","Encrypted Alert"
"302091","175.216935","192.168.1.58","54.164.178.66","TCP","66","34428  >  443 [RST, ACK] Seq=32 Ack=1 Win=400 Len=0 TSval=175205991 TSecr=772877514"
"302258","175.345314","192.168.1.58","34.196.216.149","TCP","74","53351  >  443 [SYN] Seq=0 Win=42340 Len=0 MSS=1460 SACK_PERM=1 TSval=175206003 TSecr=0 WS=128"
"302312","175.418707","192.168.1.58","34.196.216.149","TCP","66","53351  >  443 [ACK] Seq=1 Ack=1 Win=42368 Len=0 TSval=175206011 TSecr=7578071"
"302315","175.420842","192.168.1.58","34.196.216.149","TLSv1.2","583","Client Hello"
"302367","175.511615","192.168.1.58","34.196.216.149","TCP","66","53351  >  443 [ACK] Seq=518 Ack=2956 Win=48256 Len=0 TSval=175206020 TSecr=7578139"
"302373","175.530123","192.168.1.58","34.196.216.149","TLSv1.2","192","Client Key Exchange, Change Cipher Spec, Encrypted Handshake Message"
"302430","175.602458","192.168.1.58","34.196.216.149","TLSv1.2","1008","Application Data"
"302483","175.689449","192.168.1.58","34.196.216.149","TCP","1514","53351  >  443 [ACK] Seq=1586 Ack=3061 Win=48256 Len=1448 TSval=175206037 TSecr=7578183 [TCP segment of a reassembled PDU]"
"302484","175.689664","192.168.1.58","34.196.216.149","TCP","1514","53351  >  443 [ACK] Seq=3034 Ack=3061 Win=48256 Len=1448 TSval=175206038 TSecr=7578183 [TCP segment of a reassembled PDU]"
"302485","175.689803","192.168.1.58","34.196.216.149","TCP","1514","53351  >  443 [ACK] Seq=4482 Ack=3061 Win=48256 Len=1448 TSval=175206038 TSecr=7578183 [TCP segment of a reassembled PDU]"
"302486","175.689927","192.168.1.58","34.196.216.149","TCP","1514","53351  >  443 [ACK] Seq=5930 Ack=3061 Win=48256 Len=1448 TSval=175206038 TSecr=7578183 [TCP segment of a reassembled PDU]"
"302487","175.690050","192.168.1.58","34.196.216.149","TCP","1514","53351  >  443 [ACK] Seq=7378 Ack=3061 Win=48256 Len=1448 TSval=175206038 TSecr=7578183 [TCP segment of a reassembled PDU]"
"302488","175.690175","192.168.1.58","34.196.216.149","TCP","1514","53351  >  443 [ACK] Seq=8826 Ack=3061 Win=48256 Len=1448 TSval=175206038 TSecr=7578183 [TCP segment of a reassembled PDU]"
"302489","175.690295","192.168.1.58","34.196.216.149","TCP","1514","53351  >  443 [ACK] Seq=10274 Ack=3061 Win=48256 Len=1448 TSval=175206038 TSecr=7578183 [TCP segment of a reassembled PDU]"
"302490","175.690511","192.168.1.58","34.196.216.149","TCP","1514","53351  >  443 [ACK] Seq=11722 Ack=3061 Win=48256 Len=1448 TSval=175206038 TSecr=7578183 [TCP segment of a reassembled PDU]"
"302491","175.690683","192.168.1.58","34.196.216.149","TLSv1.2","583","Application Data"
"302562","175.815881","192.168.1.58","34.196.216.149","TCP","66","53351  >  443 [ACK] Seq=13687 Ack=3252 Win=51200 Len=0 TSval=175206051 TSecr=7578207"
"302621","175.905823","192.168.1.58","23.246.45.154","TCP","74","55144  >  443 [SYN] Seq=0 Win=64240 Len=0 MSS=1460 SACK_PERM=1 TSval=175206059 TSecr=0 WS=4"
"302622","175.906197","192.168.1.58","23.246.45.154","TCP","74","55145  >  443 [SYN] Seq=0 Win=64240 Len=0 MSS=1460 SACK_PERM=1 TSval=175206059 TSecr=0 WS=4"
"302623","175.906571","192.168.1.58","23.246.45.154","TCP","74","55146  >  443 [SYN] Seq=0 Win=64240 Len=0 MSS=1460 SACK_PERM=1 TSval=175206059 TSecr=0 WS=4"
"302632","175.927690","192.168.1.58","23.246.45.154","TCP","66","55146  >  443 [ACK] Seq=1 Ack=1 Win=64240 Len=0 TSval=175206062 TSecr=3907534006"
"302635","175.939359","192.168.1.58","23.246.45.154","TLSv1.2","583","Client Hello"
"302640","175.957954","192.168.1.58","23.246.45.154","TCP","66","55145  >  443 [ACK] Seq=1 Ack=1 Win=64240 Len=0 TSval=175206065 TSecr=1298106006"
"302642","175.961165","192.168.1.58","52.32.33.253","TCP","1514","57010  >  80 [ACK] Seq=33267 Ack=28390 Win=502 Len=1448 TSval=175206065 TSecr=1611743101"
"302643","175.961387","192.168.1.58","52.32.33.253","TCP","1514","57010  >  80 [ACK] Seq=34715 Ack=28390 Win=502 Len=1448 TSval=175206065 TSecr=1611743101"
"302644","175.961524","192.168.1.58","52.32.33.253","TCP","1514","57010  >  80 [ACK] Seq=36163 Ack=28390 Win=502 Len=1448 TSval=175206065 TSecr=1611743101 [TCP segment of a reassembled PDU]"
"302645","175.961647","192.168.1.58","52.32.33.253","TCP","1514","57010  >  80 [ACK] Seq=37611 Ack=28390 Win=502 Len=1448 TSval=175206065 TSecr=1611743101 [TCP segment of a reassembled PDU]"
"302646","175.961772","192.168.1.58","52.32.33.253","TCP","1514","57010  >  80 [ACK] Seq=39059 Ack=28390 Win=502 Len=1448 TSval=175206065 TSecr=1611743101 [TCP segment of a reassembled PDU]"
"302648","175.962141","192.168.1.58","23.246.45.154","TCP","66","55144  >  443 [ACK] Seq=1 Ack=1 Win=64240 Len=0 TSval=175206065 TSecr=3250182337"
"302650","175.962513","192.168.1.58","23.246.45.154","TCP","66","55146  >  443 [ACK] Seq=518 Ack=98 Win=64240 Len=0 TSval=175206065 TSecr=3907534035"
"302651","175.962640","192.168.1.58","23.246.45.154","TCP","66","55146  >  443 [ACK] Seq=518 Ack=143 Win=64240 Len=0 TSval=175206065 TSecr=3907534036"
"302660","175.978247","192.168.1.58","23.246.45.154","TLSv1.2","583","Client Hello"
"302664","175.979600","192.168.1.58","23.246.45.154","TLSv1.2","583","Client Hello"
"302666","175.980720","192.168.1.58","23.246.45.154","TLSv1.2","117","Change Cipher Spec, Encrypted Handshake Message"
"302686","176.001857","192.168.1.58","23.246.45.154","TCP","66","55145  >  443 [ACK] Seq=518 Ack=98 Win=64240 Len=0 TSval=175206069 TSecr=1298106079"
"302687","176.001990","192.168.1.58","23.246.45.154","TCP","66","55145  >  443 [ACK] Seq=518 Ack=143 Win=64240 Len=0 TSval=175206069 TSecr=1298106079"
"302689","176.002850","192.168.1.58","23.246.45.154","TLSv1.2","117","Change Cipher Spec, Encrypted Handshake Message"
"302690","176.003613","192.168.1.58","23.246.45.154","TCP","66","55144  >  443 [ACK] Seq=518 Ack=98 Win=64240 Len=0 TSval=175206069 TSecr=3250182410"
"302691","176.003838","192.168.1.58","23.246.45.154","TCP","66","55144  >  443 [ACK] Seq=518 Ack=143 Win=64240 Len=0 TSval=175206069 TSecr=3250182410"
"302696","176.016495","192.168.1.58","23.246.45.154","TLSv1.2","117","Change Cipher Spec, Encrypted Handshake Message"
"302715","176.064661","192.168.1.58","52.32.33.253","TCP","1514","57010  >  80 [ACK] Seq=40507 Ack=28390 Win=502 Len=1448 TSval=175206075 TSecr=1611754680 [TCP segment of a reassembled PDU]"
"302716","176.064897","192.168.1.58","52.32.33.253","TCP","1514","57010  >  80 [ACK] Seq=41955 Ack=28390 Win=502 Len=1448 TSval=175206075 TSecr=1611754680 [TCP segment of a reassembled PDU]"
"302717","176.065033","192.168.1.58","52.32.33.253","TCP","1514","57010  >  80 [ACK] Seq=43403 Ack=28390 Win=502 Len=1448 TSval=175206075 TSecr=1611754680 [TCP segment of a reassembled PDU]"
"302721","176.066535","192.168.1.58","52.32.33.253","TCP","70","57010  >  80 [PSH, ACK] Seq=44851 Ack=28390 Win=502 Len=4 TSval=175206075 TSecr=1611754680 [TCP segment of a reassembled PDU]"
"302724","176.103207","192.168.1.58","23.246.45.154","TLSv1.2","547","Application Data"
"302737","176.136734","192.168.1.58","23.246.45.154","TLSv1.2","547","Application Data"
"302739","176.144323","192.168.1.58","23.246.45.154","TLSv1.2","1028","Application Data, Application Data"
"302754","176.175711","192.168.1.58","23.246.45.154","TCP","66","55146  >  443 [ACK] Seq=1050 Ack=780 Win=67136 Len=0 TSval=175206087 TSecr=3907534203"
"302755","176.175938","192.168.1.58","23.246.45.154","TCP","66","55146  >  443 [ACK] Seq=1050 Ack=2228 Win=70032 Len=0 TSval=175206087 TSecr=3907534255"
"302765","176.178604","192.168.1.58","23.246.45.154","TCP","66","55146  >  443 [ACK] Seq=1050 Ack=6572 Win=78720 Len=0 TSval=175206087 TSecr=3907534255"
"302766","176.178827","192.168.1.58","23.246.45.154","TCP","66","55146  >  443 [ACK] Seq=1050 Ack=10916 Win=87408 Len=0 TSval=175206087 TSecr=3907534255"
"302767","176.179975","192.168.1.58","23.246.45.154","TCP","66","55146  >  443 [ACK] Seq=1050 Ack=13812 Win=93200 Len=0 TSval=175206087 TSecr=3907534255"
"302768","176.180206","192.168.1.58","23.246.45.154","TCP","66","55145  >  443 [ACK] Seq=1050 Ack=5125 Win=75824 Len=0 TSval=175206087 TSecr=1298106236"
"302769","176.183014","192.168.1.58","23.246.45.154","TCP","66","55145  >  443 [ACK] Seq=1050 Ack=13813 Win=93200 Len=0 TSval=175206087 TSecr=1298106259"
"302778","176.188777","192.168.1.58","52.32.33.253","TCP","66","57010  >  80 [ACK] Seq=44855 Ack=31286 Win=498 Len=0 TSval=175206088 TSecr=1611754711"
"302779","176.190129","192.168.1.58","52.32.33.253","TCP","66","57010  >  80 [ACK] Seq=44855 Ack=37914 Win=479 Len=0 TSval=175206088 TSecr=1611754711"
"302780","176.196070","192.168.1.58","23.246.45.154","TCP","66","55144  >  443 [ACK] Seq=1531 Ack=780 Win=67136 Len=0 TSval=175206089 TSecr=3250182573"
"302839","176.226337","192.168.1.58","23.246.45.154","TCP","66","55146  >  443 [ACK] Seq=1050 Ack=15260 Win=96096 Len=0 TSval=175206092 TSecr=3907534279"
"302840","176.230701","192.168.1.58","23.246.45.154","TCP","66","55146  >  443 [ACK] Seq=1050 Ack=23948 Win=113472 Len=0 TSval=175206092 TSecr=3907534279"
"302842","176.242205","192.168.1.58","23.246.45.154","TCP","66","55146  >  443 [ACK] Seq=1050 Ack=34084 Win=133744 Len=0 TSval=175206092 TSecr=3907534279"
"302843","176.242441","192.168.1.58","23.246.45.154","TCP","66","55146  >  443 [ACK] Seq=1050 Ack=38428 Win=142432 Len=0 TSval=175206092 TSecr=3907534279"
"302844","176.242647","192.168.1.58","23.246.45.154","TCP","66","55146  >  443 [ACK] Seq=1050 Ack=41324 Win=148224 Len=0 TSval=175206093 TSecr=3907534279"
"302845","176.242855","192.168.1.58","23.246.45.154","TCP","66","55145  >  443 [ACK] Seq=1050 Ack=25397 Win=116368 Len=0 TSval=175206093 TSecr=1298106285"
"302848","176.251047","192.168.1.58","23.246.45.154","TCP","66","55145  >  443 [ACK] Seq=1050 Ack=35533 Win=136640 Len=0 TSval=175206093 TSecr=1298106285"
"302849","176.251285","192.168.1.58","23.246.45.154","TCP","66","55145  >  443 [ACK] Seq=1050 Ack=41325 Win=148224 Len=0 TSval=175206093 TSecr=1298106285"
"302850","176.251505","192.168.1.58","23.246.45.154","TCP","66","55144  >  443 [ACK] Seq=1531 Ack=5124 Win=75824 Len=0 TSval=175206094 TSecr=3250182627"
"302851","176.251710","192.168.1.58","23.246.45.154","TCP","66","55144  >  443 [ACK] Seq=1531 Ack=13812 Win=93200 Len=0 TSval=175206094 TSecr=3250182627"
"302852","176.251915","192.168.1.58","23.246.45.154","TCP","66","55144  >  443 [ACK] Seq=1531 Ack=15260 Win=96096 Len=0 TSval=175206094 TSecr=3250182651"
"302853","176.253032","192.168.1.58","23.246.45.154","TCP","66","55146  >  443 [ACK] Seq=1050 Ack=44220 Win=154016 Len=0 TSval=175206094 TSecr=3907534329"
"302866","176.257717","192.168.1.58","23.246.45.154","TCP","66","55146  >  443 [ACK] Seq=1050 Ack=48564 Win=162704 Len=0 TSval=175206095 TSecr=3907534335"
"302907","176.262244","192.168.1.58","23.246.45.154","TCP","66","55146  >  443 [ACK] Seq=1050 Ack=61596 Win=188768 Len=0 TSval=175206095 TSecr=3907534335"
"302908","176.262243","192.168.1.58","23.246.45.154","TCP","66","55146  >  443 [ACK] Seq=1050 Ack=54356 Win=174288 Len=0 TSval=175206095 TSecr=3907534335"
"302909","176.262391","192.168.1.58","23.246.45.154","TCP","66","55145  >  443 [ACK] Seq=1050 Ack=47117 Win=159808 Len=0 TSval=175206095 TSecr=1298106340"
"302970","176.283224","192.168.1.58","23.246.45.154","TCP","66","55145  >  443 [ACK] Seq=1050 Ack=52909 Win=171392 Len=0 TSval=175206095 TSecr=1298106340"
"302971","176.283469","192.168.1.58","23.246.45.154","TCP","66","55145  >  443 [ACK] Seq=1050 Ack=60149 Win=185872 Len=0 TSval=175206095 TSecr=1298106340"
"302972","176.283685","192.168.1.58","23.246.45.154","TCP","78","55145  >  443 [ACK] Seq=1050 Ack=61597 Win=188768 Len=0 TSval=175206095 TSecr=1298106340 SLE=63045 SRE=64493"
"302973","176.283892","192.168.1.58","23.246.45.154","TCP","66","55145  >  443 [ACK] Seq=1050 Ack=64493 Win=191664 Len=0 TSval=175206095 TSecr=1298106340"
"302974","176.284095","192.168.1.58","23.246.45.154","TCP","66","55146  >  443 [ACK] Seq=1050 Ack=63044 Win=191664 Len=0 TSval=175206095 TSecr=3907534340"
"302975","176.284309","192.168.1.58","23.246.45.154","TCP","66","55146  >  443 [ACK] Seq=1050 Ack=68836 Win=203248 Len=0 TSval=175206096 TSecr=3907534340"
"302976","176.284510","192.168.1.58","23.246.45.154","TCP","66","55146  >  443 [ACK] Seq=1050 Ack=70284 Win=206144 Len=0 TSval=175206096 TSecr=3907534340"
"302977","176.284711","192.168.1.58","23.246.45.154","TCP","78","[TCP Dup ACK 302976#1] 55146  >  443 [ACK] Seq=1050 Ack=70284 Win=206144 Len=0 TSval=175206096 TSecr=3907534340 SLE=71732 SRE=73180"
"302978","176.284910","192.168.1.58","23.246.45.154","TCP","66","55146  >  443 [ACK] Seq=1050 Ack=73180 Win=209040 Len=0 TSval=175206096 TSecr=3907534340"
"302979","176.285116","192.168.1.58","23.246.45.154","TCP","78","[TCP Dup ACK 302978#1] 55146  >  443 [ACK] Seq=1050 Ack=73180 Win=209040 Len=0 TSval=175206096 TSecr=3907534340 SLE=74628 SRE=76076"
"303008","176.325566","192.168.1.58","23.246.45.154","TCP","86","[TCP Dup ACK 302978#2] 55146  >  443 [ACK] Seq=1050 Ack=73180 Win=209040 Len=0 TSval=175206101 TSecr=3907534340 SLE=77524 SRE=78972 SLE=74628 SRE=76076"
"303009","176.325806","192.168.1.58","23.246.45.154","TCP","78","[TCP Dup ACK 302978#3] 55146  >  443 [ACK] Seq=1050 Ack=73180 Win=209040 Len=0 TSval=175206101 TSecr=3907534340 SLE=74628 SRE=78972"
"303010","176.326017","192.168.1.58","23.246.45.154","TCP","78","[TCP Dup ACK 302978#4] 55146  >  443 [ACK] Seq=1050 Ack=73180 Win=209040 Len=0 TSval=175206101 TSecr=3907534340 SLE=74628 SRE=80420"
"303011","176.340620","192.168.1.58","23.246.45.154","TCP","78","[TCP Dup ACK 302978#5] 55146  >  443 [ACK] Seq=1050 Ack=73180 Win=209040 Len=0 TSval=175206102 TSecr=3907534340 SLE=74628 SRE=81868"
"303012","176.340864","192.168.1.58","23.246.45.154","TCP","86","[TCP Dup ACK 302978#6] 55146  >  443 [ACK] Seq=1050 Ack=73180 Win=209040 Len=0 TSval=175206102 TSecr=3907534340 SLE=83316 SRE=84764 SLE=74628 SRE=81868"
"303013","176.341076","192.168.1.58","23.246.45.154","TCP","78","[TCP Dup ACK 302978#7] 55146  >  443 [ACK] Seq=1050 Ack=73180 Win=209040 Len=0 TSval=175206102 TSecr=3907534340 SLE=74628 SRE=84764"
"303014","176.341283","192.168.1.58","23.246.45.154","TCP","78","[TCP Dup ACK 302978#8] 55146  >  443 [ACK] Seq=1050 Ack=73180 Win=209040 Len=0 TSval=175206102 TSecr=3907534340 SLE=74628 SRE=87660"
"303015","176.341484","192.168.1.58","23.246.45.154","TCP","86","[TCP Dup ACK 302978#9] 55146  >  443 [ACK] Seq=1050 Ack=73180 Win=209040 Len=0 TSval=175206102 TSecr=3907534340 SLE=89108 SRE=90556 SLE=74628 SRE=87660"
"303016","176.341685","192.168.1.58","23.246.45.154","TCP","78","[TCP Dup ACK 302978#10] 55146  >  443 [ACK] Seq=1050 Ack=73180 Win=209040 Len=0 TSval=175206102 TSecr=3907534340 SLE=74628 SRE=90556"
"303017","176.341889","192.168.1.58","23.246.45.154","TCP","86","[TCP Dup ACK 302978#11] 55146  >  443 [ACK] Seq=1050 Ack=73180 Win=209040 Len=0 TSval=175206102 TSecr=3907534340 SLE=92004 SRE=93452 SLE=74628 SRE=90556"
"303018","176.342092","192.168.1.58","23.246.45.154","TCP","78","[TCP Dup ACK 302978#12] 55146  >  443 [ACK] Seq=1050 Ack=73180 Win=209040 Len=0 TSval=175206102 TSecr=3907534340 SLE=74628 SRE=93452"
"303019","176.342317","192.168.1.58","23.246.45.154","TCP","66","55145  >  443 [ACK] Seq=1050 Ack=80421 Win=223520 Len=0 TSval=175206102 TSecr=1298106347"
"303020","176.342436","192.168.1.58","23.246.45.154","TCP","78","[TCP Dup ACK 303019#1] 55145  >  443 [ACK] Seq=1050 Ack=80421 Win=223520 Len=0 TSval=175206102 TSecr=1298106347 SLE=81869 SRE=83317"
"303021","176.342499","192.168.1.58","23.246.45.154","TCP","66","55145  >  443 [ACK] Seq=1050 Ack=83317 Win=226416 Len=0 TSval=175206102 TSecr=1298106347"
"303022","176.342581","192.168.1.58","23.246.45.154","TCP","66","55145  >  443 [ACK] Seq=1050 Ack=86213 Win=232208 Len=0 TSval=175206102 TSecr=1298106347"
"303023","176.342626","192.168.1.58","23.246.45.154","TCP","78","[TCP Dup ACK 303022#1] 55145  >  443 [ACK] Seq=1050 Ack=86213 Win=232208 Len=0 TSval=175206102 TSecr=1298106347 SLE=87661 SRE=89109"
"303024","176.342721","192.168.1.58","23.246.45.154","TCP","66","55145  >  443 [ACK] Seq=1050 Ack=89109 Win=235104 Len=0 TSval=175206102 TSecr=1298106347"
"303025","176.342725","192.168.1.58","23.246.45.154","TCP","66","55145  >  443 [ACK] Seq=1050 Ack=92005 Win=240896 Len=0 TSval=175206102 TSecr=1298106347"
"303026","176.342859","192.168.1.58","23.246.45.154","TCP","78","[TCP Dup ACK 302978#13] 55146  >  443 [ACK] Seq=1050 Ack=73180 Win=209040 Len=0 TSval=175206102 TSecr=3907534340 SLE=74628 SRE=96348"
"303027","176.342854","192.168.1.58","23.246.45.154","TCP","78","[TCP Dup ACK 303025#1] 55145  >  443 [ACK] Seq=1050 Ack=92005 Win=240896 Len=0 TSval=175206102 TSecr=1298106347 SLE=93453 SRE=94901"
"303028","176.342988","192.168.1.58","23.246.45.154","TCP","66","55145  >  443 [ACK] Seq=1050 Ack=96349 Win=241344 Len=0 TSval=175206102 TSecr=1298106347"
"303029","176.342983","192.168.1.58","23.246.45.154","TCP","66","55145  >  443 [ACK] Seq=1050 Ack=94901 Win=242272 Len=0 TSval=175206102 TSecr=1298106347"
"303030","176.343114","192.168.1.58","23.246.45.154","TCP","78","[TCP Dup ACK 302978#14] 55146  >  443 [ACK] Seq=1050 Ack=73180 Win=209040 Len=0 TSval=175206102 TSecr=3907534340 SLE=74628 SRE=99244"
"303031","176.343119","192.168.1.58","23.246.45.154","TCP","66","55144  >  443 [ACK] Seq=1531 Ack=25396 Win=116368 Len=0 TSval=175206102 TSecr=3250182682"
"303032","176.343249","192.168.1.58","23.246.45.154","TCP","78","55144  >  443 [ACK] Seq=1531 Ack=39876 Win=145328 Len=0 TSval=175206102 TSecr=3250182682 SLE=41324 SRE=42772"
"303033","176.343246","192.168.1.58","23.246.45.154","TCP","66","[TCP Dup ACK 303032#1] 55144  >  443 [ACK] Seq=1531 Ack=39876 Win=145328 Len=0 TSval=175206102 TSecr=3250182682"
"303034","176.343386","192.168.1.58","23.246.45.154","TCP","66","55144  >  443 [ACK] Seq=1531 Ack=44220 Win=151120 Len=0 TSval=175206102 TSecr=3250182682"
"303035","176.343380","192.168.1.58","23.246.45.154","TCP","66","55144  >  443 [ACK] Seq=1531 Ack=42772 Win=148224 Len=0 TSval=175206102 TSecr=3250182682"
"303036","176.343529","192.168.1.58","23.246.45.154","TCP","78","[TCP Dup ACK 302978#15] 55146  >  443 [ACK] Seq=1050 Ack=73180 Win=209040 Len=0 TSval=175206102 TSecr=3907534340 SLE=74628 SRE=107932"
"303037","176.343523","192.168.1.58","23.246.45.154","TCP","78","[TCP Dup ACK 302978#16] 55146  >  443 [ACK] Seq=1050 Ack=73180 Win=209040 Len=0 TSval=175206102 TSecr=3907534340 SLE=74628 SRE=106484"
"303038","176.345513","192.168.1.58","23.246.45.154","TCP","78","[TCP Dup ACK 302978#17] 55146  >  443 [ACK] Seq=1050 Ack=73180 Win=209040 Len=0 TSval=175206103 TSecr=3907534340 SLE=74628 SRE=109380"
"303039","176.345751","192.168.1.58","23.246.45.154","TCP","66","55145  >  443 [ACK] Seq=1050 Ack=102141 Win=255376 Len=0 TSval=175206103 TSecr=1298106363"
"303040","176.345959","192.168.1.58","23.246.45.154","TCP","78","[TCP Dup ACK 302978#18] 55146  >  443 [ACK] Seq=1050 Ack=73180 Win=209040 Len=0 TSval=175206103 TSecr=3907534340 SLE=74628 SRE=116620"
"303041","176.346167","192.168.1.58","23.246.45.154","TCP","66","55145  >  443 [ACK] Seq=1050 Ack=113725 Win=250912 Len=0 TSval=175206103 TSecr=1298106378"
"303042","176.350520","192.168.1.58","23.246.45.154","TCP","66","55145  >  443 [ACK] Seq=1050 Ack=115173 Win=249984 Len=0 TSval=175206104 TSecr=1298106378"
"303043","176.350762","192.168.1.58","23.246.45.154","TCP","78","[TCP Dup ACK 302978#19] 55146  >  443 [ACK] Seq=1050 Ack=73180 Win=209040 Len=0 TSval=175206104 TSecr=3907534340 SLE=74628 SRE=125308"
"303044","176.350977","192.168.1.58","23.246.45.154","TCP","86","[TCP Dup ACK 302978#20] 55146  >  443 [ACK] Seq=1050 Ack=73180 Win=209040 Len=0 TSval=175206104 TSecr=3907534340 SLE=70284 SRE=71732 SLE=74628 SRE=125308"
"303045","176.351177","192.168.1.58","23.246.45.154","TCP","78","[TCP Dup ACK 302978#21] 55146  >  443 [ACK] Seq=1050 Ack=73180 Win=209040 Len=0 TSval=175206104 TSecr=3907534340 SLE=74628 SRE=128204"
"303047","176.351590","192.168.1.58","23.246.45.154","TCP","66","55145  >  443 [ACK] Seq=1050 Ack=119517 Win=247200 Len=0 TSval=175206104 TSecr=1298106381"
"303048","176.351798","192.168.1.58","23.246.45.154","TCP","66","55146  >  443 [ACK] Seq=1050 Ack=128204 Win=211936 Len=0 TSval=175206104 TSecr=3907534388"
"303051","176.357435","192.168.1.58","23.246.45.154","TCP","66","55146  >  443 [ACK] Seq=1050 Ack=129652 Win=214832 Len=0 TSval=175206105 TSecr=3907534435"
"303052","176.357681","192.168.1.58","23.246.45.154","TCP","66","55144  >  443 [ACK] Seq=1531 Ack=45668 Win=154016 Len=0 TSval=175206105 TSecr=3250182764"
"303096","176.363127","192.168.1.58","23.246.45.154","TCP","66","55145  >  443 [ACK] Seq=1050 Ack=123861 Win=259264 Len=0 TSval=175206105 TSecr=1298106441"
"303098","176.363247","192.168.1.58","23.246.45.154","TCP","66","55146  >  443 [ACK] Seq=1050 Ack=131100 Win=217728 Len=0 TSval=175206105 TSecr=3907534441"
"303142","176.365874","192.168.1.58","23.246.45.154","TCP","66","55145  >  443 [ACK] Seq=1050 Ack=131101 Win=254624 Len=0 TSval=175206105 TSecr=1298106441"
"303147","176.374715","192.168.1.58","23.246.45.154","TCP","66","55146  >  443 [ACK] Seq=1050 Ack=132548 Win=220624 Len=0 TSval=175206106 TSecr=3907534441"
"303148","176.374943","192.168.1.58","23.246.45.154","TCP","66","55145  >  443 [ACK] Seq=1050 Ack=135445 Win=251840 Len=0 TSval=175206106 TSecr=1298106441"
"303149","176.375139","192.168.1.58","23.246.45.154","TCP","66","55146  >  443 [ACK] Seq=1050 Ack=133996 Win=223520 Len=0 TSval=175206106 TSecr=3907534441"
"303150","176.375354","192.168.1.58","23.246.45.154","TCP","66","55146  >  443 [ACK] Seq=1050 Ack=135444 Win=226416 Len=0 TSval=175206106 TSecr=3907534441"
"303151","176.375554","192.168.1.58","23.246.45.154","TCP","78","[TCP Dup ACK 303148#1] 55145  >  443 [ACK] Seq=1050 Ack=135445 Win=251840 Len=0 TSval=175206106 TSecr=1298106441 SLE=80421 SRE=81869"
"303153","176.375916","192.168.1.58","23.246.45.154","TCP","66","55146  >  443 [ACK] Seq=1050 Ack=136892 Win=229312 Len=0 TSval=175206106 TSecr=3907534441"
"303154","176.376128","192.168.1.58","23.246.45.154","TCP","66","55145  >  443 [ACK] Seq=1050 Ack=136893 Win=250912 Len=0 TSval=175206106 TSecr=1298106441"
"303156","176.376485","192.168.1.58","23.246.45.154","TCP","66","55145  >  443 [ACK] Seq=1050 Ack=138341 Win=249984 Len=0 TSval=175206106 TSecr=1298106441"
"303179","176.441828","192.168.1.58","23.246.45.154","TCP","66","55146  >  443 [ACK] Seq=1050 Ack=138340 Win=232208 Len=0 TSval=175206110 TSecr=3907534441"
"303180","176.442076","192.168.1.58","23.246.45.154","TCP","66","55145  >  443 [ACK] Seq=1050 Ack=141237 Win=260192 Len=0 TSval=175206110 TSecr=1298106441"
"303181","176.442283","192.168.1.58","23.246.45.154","TCP","78","[TCP Dup ACK 303180#1] 55145  >  443 [ACK] Seq=1050 Ack=141237 Win=260192 Len=0 TSval=175206110 TSecr=1298106441 SLE=86213 SRE=87661"
"303182","176.442483","192.168.1.58","23.246.45.154","TCP","66","55145  >  443 [ACK] Seq=1050 Ack=142685 Win=259264 Len=0 TSval=175206110 TSecr=1298106441"
"303183","176.442682","192.168.1.58","23.246.45.154","TCP","78","[TCP Dup ACK 303182#1] 55145  >  443 [ACK] Seq=1050 Ack=142685 Win=259264 Len=0 TSval=175206110 TSecr=1298106441 SLE=92005 SRE=93453"
"303184","176.442881","192.168.1.58","23.246.45.154","TCP","66","55146  >  443 [ACK] Seq=1050 Ack=142684 Win=240896 Len=0 TSval=175206110 TSecr=3907534441"
"303185","176.443074","192.168.1.58","23.246.45.154","TCP","66","55145  >  443 [ACK] Seq=1050 Ack=144133 Win=258336 Len=0 TSval=175206110 TSecr=1298106441"
"303186","176.443275","192.168.1.58","23.246.45.154","TCP","66","55146  >  443 [ACK] Seq=1050 Ack=145580 Win=246688 Len=0 TSval=175206110 TSecr=3907534441"
"303187","176.443427","192.168.1.58","23.246.45.154","TCP","66","55145  >  443 [ACK] Seq=1050 Ack=147029 Win=256480 Len=0 TSval=175206110 TSecr=1298106441"
"303188","176.443450","192.168.1.58","23.246.45.154","TCP","66","55145  >  443 [ACK] Seq=1050 Ack=151373 Win=259264 Len=0 TSval=175206110 TSecr=1298106441"
"303189","176.443583","192.168.1.58","23.246.45.154","TCP","78","[TCP Dup ACK 303188#1] 55145  >  443 [ACK] Seq=1050 Ack=151373 Win=259264 Len=0 TSval=175206110 TSecr=1298106441 SLE=152821 SRE=154269"
"303190","176.443578","192.168.1.58","23.246.45.154","TCP","66","55146  >  443 [ACK] Seq=1050 Ack=147028 Win=249584 Len=0 TSval=175206110 TSecr=3907534441"
"303191","176.443711","192.168.1.58","23.246.45.154","TCP","66","55145  >  443 [ACK] Seq=1050 Ack=154269 Win=257312 Len=0 TSval=175206111 TSecr=1298106441"
"303192","176.443714","192.168.1.58","23.246.45.154","TCP","78","[TCP Dup ACK 303191#1] 55145  >  443 [ACK] Seq=1050 Ack=154269 Win=257312 Len=0 TSval=175206111 TSecr=1298106441 SLE=155717 SRE=157165"
"303193","176.443852","192.168.1.58","23.246.45.154","TCP","78","55145  >  443 [ACK] Seq=1050 Ack=157165 Win=255360 Len=0 TSval=175206111 TSecr=1298106441 SLE=158613 SRE=160061"
"303194","176.443846","192.168.1.58","23.246.45.154","TCP","66","[TCP Dup ACK 303193#1] 55145  >  443 [ACK] Seq=1050 Ack=157165 Win=255360 Len=0 TSval=175206111 TSecr=1298106441"
"303195","176.443978","192.168.1.58","23.246.45.154","TCP","66","55145  >  443 [ACK] Seq=1050 Ack=160061 Win=253408 Len=0 TSval=175206111 TSecr=1298106441"
"303196","176.447501","192.168.1.58","23.246.45.154","TCP","66","55145  >  443 [ACK] Seq=1050 Ack=161509 Win=252480 Len=0 TSval=175206111 TSecr=1298106441"
"303197","176.447739","192.168.1.58","23.246.45.154","TCP","66","55145  >  443 [ACK] Seq=1050 Ack=162957 Win=251552 Len=0 TSval=175206111 TSecr=1298106441"
"303198","176.447952","192.168.1.58","23.246.45.154","TCP","78","[TCP Dup ACK 303197#1] 55145  >  443 [ACK] Seq=1050 Ack=162957 Win=251552 Len=0 TSval=175206111 TSecr=1298106441 SLE=164405 SRE=165853"
"303199","176.448154","192.168.1.58","23.246.45.154","TCP","66","55145  >  443 [ACK] Seq=1050 Ack=165853 Win=249600 Len=0 TSval=175206111 TSecr=1298106441"
"303200","176.448337","192.168.1.58","23.246.45.154","TCP","66","55145  >  443 [ACK] Seq=1050 Ack=168749 Win=247744 Len=0 TSval=175206111 TSecr=1298106441"
"303201","176.448531","192.168.1.58","23.246.45.154","TCP","66","55144  >  443 [ACK] Seq=1531 Ack=48564 Win=159808 Len=0 TSval=175206111 TSecr=3250182772"
"303202","176.448732","192.168.1.58","23.246.45.154","TCP","66","55145  >  443 [ACK] Seq=1050 Ack=170197 Win=260696 Len=0 TSval=175206111 TSecr=1298106441"
"303203","176.448941","192.168.1.58","23.246.45.154","TCP","66","55144  >  443 [ACK] Seq=1531 Ack=50012 Win=162704 Len=0 TSval=175206111 TSecr=3250182772"
"303204","176.449159","192.168.1.58","23.246.45.154","TCP","66","55144  >  443 [ACK] Seq=1531 Ack=55804 Win=174288 Len=0 TSval=175206111 TSecr=3250182772"
"303205","176.449177","192.168.1.58","23.246.45.154","TCP","78","[TCP Dup ACK 303204#1] 55144  >  443 [ACK] Seq=1531 Ack=55804 Win=174288 Len=0 TSval=175206111 TSecr=3250182772 SLE=57252 SRE=58700"
"303206","176.449342","192.168.1.58","23.246.45.154","TCP","78","55144  >  443 [ACK] Seq=1531 Ack=58700 Win=177184 Len=0 TSval=175206112 TSecr=3250182772 SLE=60148 SRE=61596"
"303207","176.449338","192.168.1.58","23.246.45.154","TCP","66","[TCP Dup ACK 303206#1] 55144  >  443 [ACK] Seq=1531 Ack=58700 Win=177184 Len=0 TSval=175206112 TSecr=3250182772"
"303208","176.449474","192.168.1.58","23.246.45.154","TCP","66","55144  >  443 [ACK] Seq=1531 Ack=61596 Win=180080 Len=0 TSval=175206112 TSecr=3250182772"
"303209","176.449477","192.168.1.58","23.246.45.154","TCP","78","[TCP Dup ACK 303208#1] 55144  >  443 [ACK] Seq=1531 Ack=61596 Win=180080 Len=0 TSval=175206112 TSecr=3250182772 SLE=63044 SRE=64492"
"303210","176.449604","192.168.1.58","23.246.45.154","TCP","66","55144  >  443 [ACK] Seq=1531 Ack=64492 Win=182976 Len=0 TSval=175206112 TSecr=3250182772"
"303211","176.449608","192.168.1.58","23.246.45.154","TCP","78","[TCP Dup ACK 303210#1] 55144  >  443 [ACK] Seq=1531 Ack=64492 Win=182976 Len=0 TSval=175206112 TSecr=3250182772 SLE=39876 SRE=41324"
"303212","176.449731","192.168.1.58","23.246.45.154","TCP","66","55144  >  443 [ACK] Seq=1531 Ack=65940 Win=185872 Len=0 TSval=175206112 TSecr=3250182773"
"303213","176.449733","192.168.1.58","23.246.45.154","TCP","78","[TCP Dup ACK 303212#1] 55144  >  443 [ACK] Seq=1531 Ack=65940 Win=185872 Len=0 TSval=175206112 TSecr=3250182773 SLE=67388 SRE=68836"
"303214","176.449856","192.168.1.58","23.246.45.154","TCP","66","55144  >  443 [ACK] Seq=1531 Ack=68836 Win=188768 Len=0 TSval=175206112 TSecr=3250182773"
"303215","176.449860","192.168.1.58","23.246.45.154","TCP","78","[TCP Dup ACK 303214#1] 55144  >  443 [ACK] Seq=1531 Ack=68836 Win=188768 Len=0 TSval=175206112 TSecr=3250182773 SLE=70284 SRE=71732"
"303216","176.449981","192.168.1.58","23.246.45.154","TCP","66","55144  >  443 [ACK] Seq=1531 Ack=71732 Win=191664 Len=0 TSval=175206112 TSecr=3250182773"
"303217","176.449985","192.168.1.58","23.246.45.154","TCP","66","55144  >  443 [ACK] Seq=1531 Ack=77524 Win=203248 Len=0 TSval=175206112 TSecr=3250182773"
"303218","176.450112","192.168.1.58","23.246.45.154","TCP","66","55144  >  443 [ACK] Seq=1531 Ack=80420 Win=206144 Len=0 TSval=175206112 TSecr=3250182773"
"303219","176.450108","192.168.1.58","23.246.45.154","TCP","78","55144  >  443 [ACK] Seq=1531 Ack=77524 Win=203248 Len=0 TSval=175206112 TSecr=3250182773 SLE=78972 SRE=80420"
"303220","176.450236","192.168.1.58","23.246.45.154","TCP","66","55144  >  443 [ACK] Seq=1531 Ack=84764 Win=214832 Len=0 TSval=175206112 TSecr=3250182773"
"303221","176.450243","192.168.1.58","23.246.45.154","TCP","66","55146  >  443 [ACK] Seq=1050 Ack=148476 Win=252480 Len=0 TSval=175206113 TSecr=3907534446"
"303222","176.450367","192.168.1.58","23.246.45.154","TCP","78","[TCP Dup ACK 303221#1] 55146  >  443 [ACK] Seq=1050 Ack=148476 Win=252480 Len=0 TSval=175206113 TSecr=3907534446 SLE=149924 SRE=151372"
"303223","176.450370","192.168.1.58","23.246.45.154","TCP","66","55146  >  443 [ACK] Seq=1050 Ack=151372 Win=255376 Len=0 TSval=175206113 TSecr=3907534446"
"303224","176.450600","192.168.1.58","23.246.45.154","TCP","66","55146  >  443 [ACK] Seq=1050 Ack=154268 Win=257312 Len=0 TSval=175206113 TSecr=3907534446"
"303225","176.450598","192.168.1.58","23.246.45.154","TCP","66","55146  >  443 [ACK] Seq=1050 Ack=152820 Win=258240 Len=0 TSval=175206113 TSecr=3907534446"
"303226","176.450732","192.168.1.58","23.246.45.154","TCP","78","55146  >  443 [ACK] Seq=1050 Ack=154268 Win=257312 Len=0 TSval=175206113 TSecr=3907534446 SLE=155716 SRE=157164"
"303227","176.450736","192.168.1.58","23.246.45.154","TCP","66","55146  >  443 [ACK] Seq=1050 Ack=157164 Win=255360 Len=0 TSval=175206113 TSecr=3907534446"
"303228","176.451335","192.168.1.58","23.246.45.154","TCP","66","55146  >  443 [ACK] Seq=1050 Ack=158612 Win=254432 Len=0 TSval=175206113 TSecr=3907534446"
"303229","176.451574","192.168.1.58","23.246.45.154","TCP","66","55145  >  443 [ACK] Seq=1050 Ack=171645 Win=260192 Len=0 TSval=175206113 TSecr=1298106447"
"303230","176.451779","192.168.1.58","23.246.45.154","TCP","66","55146  >  443 [ACK] Seq=1050 Ack=160060 Win=253504 Len=0 TSval=175206113 TSecr=3907534451"
"303231","176.451958","192.168.1.58","23.246.45.154","TCP","66","55145  >  443 [ACK] Seq=1050 Ack=175989 Win=257408 Len=0 TSval=175206113 TSecr=1298106447"
"303232","176.452145","192.168.1.58","23.246.45.154","TCP","66","55146  >  443 [ACK] Seq=1050 Ack=161508 Win=252576 Len=0 TSval=175206113 TSecr=3907534457"
"303233","176.452316","192.168.1.58","23.246.45.154","TCP","66","55145  >  443 [ACK] Seq=1050 Ack=177437 Win=256480 Len=0 TSval=175206113 TSecr=1298106457"
"303234","176.452498","192.168.1.58","23.246.45.154","TCP","66","55145  >  443 [ACK] Seq=1050 Ack=180333 Win=260192 Len=0 TSval=175206113 TSecr=1298106457"
"303235","176.452676","192.168.1.58","23.246.45.154","TCP","66","55144  >  443 [ACK] Seq=1531 Ack=89108 Win=223520 Len=0 TSval=175206113 TSecr=3250182788"
